{
  "meta": {
    "schema_version": "0.5.0",
    "generated_at": "2025-11-13T16:14:46.793Z"
  },
  "client": {
    "brand": "quick_demo",
    "place_id": "999999999",
    "business": {
      "name": "퀵데모",
      "phone": "02-111-2222",
      "address": {
        "raw": "서울특별시 중구 세종대로 110"
      },
      "category": {
        "primary": "카페",
        "subcategories": []
      },
      "web": {
        "website": "",
        "sns": {}
      },
      "ops": {}
    }
  },
  "keywords": {
    "core": [
      "카페"
    ],
    "region": [
      "서울특별시 중구 세종대로 110"
    ],
    "attributes": []
  },
  "assets": {
    "photos": [],
    "menus": []
  },
  "analysis": {
    "issues": [],
    "missing": [],
    "relevance": {},
    "popularity": {},
    "trust": {},
    "nap_mismatch": {
      "name": false,
      "phone": false,
      "address": false,
      "details": {
        "intake": {
          "name": "퀵데모",
          "phone": "02-111-2222",
          "address": "서울특별시 중구 세종대로 110"
        },
        "collected": {
          "name": "퀵데모",
          "phone": "02-111-2222",
          "address": "서울특별시 중구 세종대로 110"
        }
      }
    }
  },
  "improvements": {
    "keyword_proposals": [],
    "intro_text": "",
    "news_calendar": [],
    "review_templates": [],
    "visual_suggestions": []
  },
  "provenance": {
    "collector": {
      "source": "naver_place"
    },
    "analyzer": {},
    "improver": {},
    "generator": {}
  }
}