{
  "meta": {
    "schema_version": "0.5.0",
    "generated_at": "2025-11-13T17:35:40.411Z"
  },
  "client": {
    "brand": "sample_brand",
    "place_id": "1265317185",
    "business": {
      "name": "샘플가게",
      "phone": "02-000-0000",
      "address": {
        "raw": "서울특별시 강남구 테헤란로 1"
      },
      "category": {
        "primary": "음식점",
        "subcategories": [
          "한식"
        ]
      },
      "web": {
        "website": "",
        "sns": {}
      },
      "ops": {}
    }
  },
  "keywords": {
    "core": [
      "음식점"
    ],
    "region": [
      "서울특별시 강남구 테헤란로 1"
    ],
    "attributes": []
  },
  "assets": {
    "photos": [],
    "menus": []
  },
  "analysis": {
    "issues": [],
    "missing": [],
    "relevance": {},
    "popularity": {},
    "trust": {},
    "nap_mismatch": {
      "name": false,
      "phone": false,
      "address": false,
      "details": {
        "intake": {
          "name": "샘플가게",
          "phone": "02-000-0000",
          "address": "서울특별시 강남구 테헤란로 1"
        },
        "collected": {
          "name": "샘플가게",
          "phone": "02-000-0000",
          "address": "서울특별시 강남구 테헤란로 1"
        }
      }
    }
  },
  "improvements": {
    "keyword_proposals": [],
    "intro_text": "",
    "news_calendar": [],
    "review_templates": [],
    "visual_suggestions": []
  },
  "provenance": {
    "collector": {
      "source": "naver_place"
    },
    "analyzer": {},
    "improver": {},
    "generator": {}
  }
}