{
  "meta": {
    "schema_version": "0.5.0",
    "generated_at": "2025-11-13T16:14:46.793Z"
  },
  "client": {
    "brand": "quick_demo",
    "place_id": "999999999",
    "business": {
      "name": "퀵데모",
      "phone": "02-111-2222",
      "address": {
        "raw": "서울특별시 중구 세종대로 110"
      },
      "category": {
        "primary": "카페",
        "subcategories": []
      },
      "web": {
        "website": "",
        "sns": {}
      },
      "ops": {}
    }
  },
  "keywords": {
    "core": [
      "카페"
    ],
    "region": [
      "서울특별시",
      "중구",
      "세종대로",
      "110"
    ],
    "attributes": [],
    "details": [
      {
        "facet": "core",
        "canonical": "카페",
        "confidence": "medium",
        "evidence": {
          "rule": "fallback-category",
          "source": "collected.category",
          "text": "카페"
        }
      },
      {
        "facet": "core",
        "canonical": "카페",
        "confidence": "medium",
        "evidence": {
          "rule": "fallback-category",
          "source": "intake.category",
          "text": "카페"
        }
      },
      {
        "facet": "region",
        "canonical": "서울특별시",
        "confidence": "medium",
        "evidence": {
          "rule": "token-address",
          "source": "address.raw",
          "text": "서울특별시"
        }
      },
      {
        "facet": "region",
        "canonical": "중구",
        "confidence": "medium",
        "evidence": {
          "rule": "token-address",
          "source": "address.raw",
          "text": "중구"
        }
      },
      {
        "facet": "region",
        "canonical": "세종대로",
        "confidence": "medium",
        "evidence": {
          "rule": "token-address",
          "source": "address.raw",
          "text": "세종대로"
        }
      },
      {
        "facet": "region",
        "canonical": "110",
        "confidence": "medium",
        "evidence": {
          "rule": "token-address",
          "source": "address.raw",
          "text": "110"
        }
      }
    ]
  },
  "assets": {
    "photos": [],
    "menus": []
  },
  "analysis": {
    "issues": [],
    "missing": [
      "assets.photos"
    ],
    "relevance": {
      "score": "unknown",
      "basis": []
    },
    "popularity": {
      "score": "unknown",
      "basis": []
    },
    "trust": {
      "score": "unknown",
      "basis": []
    },
    "nap_mismatch": {
      "name": false,
      "phone": false,
      "address": false,
      "details": {
        "intake": {
          "name": "퀵데모",
          "phone": "02-111-2222",
          "address": "서울특별시 중구 세종대로 110"
        },
        "collected": {
          "name": "퀵데모",
          "phone": "02-111-2222",
          "address": "서울특별시 중구 세종대로 110"
        }
      }
    }
  },
  "improvements": {
    "keyword_proposals": [],
    "intro_text": "",
    "news_calendar": [],
    "review_templates": [],
    "visual_suggestions": []
  },
  "provenance": {
    "collector": {
      "source": "naver_place"
    },
    "analyzer": {},
    "improver": {},
    "generator": {}
  }
}