{
  "meta": {
    "schema_version": "0.5.0",
    "generated_at": "2025-11-13T17:35:40.411Z"
  },
  "client": {
    "brand": "sample_brand",
    "place_id": "1265317185",
    "business": {
      "name": "샘플가게",
      "phone": "02-000-0000",
      "address": {
        "raw": "서울특별시 강남구 테헤란로 1"
      },
      "category": {
        "primary": "음식점",
        "subcategories": [
          "한식"
        ]
      },
      "web": {
        "website": "",
        "sns": {}
      },
      "ops": {}
    }
  },
  "keywords": {
    "core": [
      "음식점"
    ],
    "region": [
      "서울특별시",
      "강남구",
      "테헤란로",
      "1"
    ],
    "attributes": [],
    "details": [
      {
        "facet": "core",
        "canonical": "음식점",
        "confidence": "medium",
        "evidence": {
          "rule": "fallback-category",
          "source": "collected.category",
          "text": "음식점"
        }
      },
      {
        "facet": "core",
        "canonical": "음식점",
        "confidence": "medium",
        "evidence": {
          "rule": "fallback-category",
          "source": "intake.category",
          "text": "음식점"
        }
      },
      {
        "facet": "region",
        "canonical": "서울특별시",
        "confidence": "medium",
        "evidence": {
          "rule": "token-address",
          "source": "address.raw",
          "text": "서울특별시"
        }
      },
      {
        "facet": "region",
        "canonical": "강남구",
        "confidence": "medium",
        "evidence": {
          "rule": "token-address",
          "source": "address.raw",
          "text": "강남구"
        }
      },
      {
        "facet": "region",
        "canonical": "테헤란로",
        "confidence": "medium",
        "evidence": {
          "rule": "token-address",
          "source": "address.raw",
          "text": "테헤란로"
        }
      },
      {
        "facet": "region",
        "canonical": "1",
        "confidence": "medium",
        "evidence": {
          "rule": "token-address",
          "source": "address.raw",
          "text": "1"
        }
      }
    ]
  },
  "assets": {
    "photos": [],
    "menus": []
  },
  "analysis": {
    "issues": [],
    "missing": [
      "assets.photos"
    ],
    "relevance": {
      "score": "unknown",
      "basis": []
    },
    "popularity": {
      "score": "unknown",
      "basis": []
    },
    "trust": {
      "score": "unknown",
      "basis": []
    },
    "nap_mismatch": {
      "name": false,
      "phone": false,
      "address": false,
      "details": {
        "intake": {
          "name": "샘플가게",
          "phone": "02-000-0000",
          "address": "서울특별시 강남구 테헤란로 1"
        },
        "collected": {
          "name": "샘플가게",
          "phone": "02-000-0000",
          "address": "서울특별시 강남구 테헤란로 1"
        }
      }
    }
  },
  "improvements": {
    "keyword_proposals": [],
    "intro_text": "",
    "news_calendar": [],
    "review_templates": [],
    "visual_suggestions": []
  },
  "provenance": {
    "collector": {
      "source": "naver_place"
    },
    "analyzer": {},
    "improver": {},
    "generator": {}
  }
}